RotterdamStudyCohort2,population based,observational design,"The study aims to investigate the epidemiology of cardiometabolic disorders, including coronary heart disease (CHD), heart failure (HF), atrial fibrillation (AF), type 2 diabetes (T2D), and metabolic syndrome. It focuses on understanding the etiology, prediction, and prognosis of these conditions, providing sex- and gender-specific insights across the spectrum of cardiometabolic disorders.","Rotterdam, Netherlands",Erasmus MC University Medical Center,Maryam Kavousi,m.kavousi@erasmusmc.nl,Maryam Kavousi; Ali Farzaneh,m.kavousi@erasmusmc.nl; a.farzanehalanagh@erasmusmc.nl,14926,5/7/1989,,yes,,"Baseline and follow-up in-person examinations every 3 to 6 years, including home interviews and in-facility medical assessments. Continuous follow-up for health outcomes via automated linkage with general practitioners, pharmacy records, hospital discharge letters, national cancer registry, and other health databases. Repeated laboratory measurements and imaging (MRI, CT, ultrasound) as scheduled per sub-study. ",Dutch (primary);English ( For scientific documentation ),SPSS,Own coding system,,,male=41.2%;female=58.8%,myocardial infarction; heart failure; atrial fibrillation; stroke; Diabetes;  metabolic diseases; Neurodegenerative and psychiatric disorders,European descent,65.8 ± 10.4,,,,,, <= 76.2 and  >= 55.4  years old,,,,,,,,,,percutaneous coronary intervention (PCI);coronary artery bypass graft (CABG),,"The Rotterdam Study does not have a single primary outcome due to its broad, multi-disease, population-based design. Instead, it focuses on multiple major outcomes related to chronic and age-related diseases. These include incident cardiovascular events (e.g., myocardial infarction, heart failure, atrial fibrillation), neurodegenerative diseases (e.g., dementia, Parkinson’s disease), diabetes, cancer, respiratory diseases, and mortality","quality of life assessments;disability;functional decline;mental health outcomes; sleep quality; lifestyle factors;Long-term morbidity; mortality across multiple domains (including cardiovascular, neurological, metabolic, oncological) are also evaluated. ",,,,
RotterdamStudyCohort3,population based,observational design,"The study aims to investigate the epidemiology of cardiometabolic disorders, including coronary heart disease (CHD), heart failure (HF), atrial fibrillation (AF), type 2 diabetes (T2D), and metabolic syndrome. It focuses on understanding the etiology, prediction, and prognosis of these conditions, providing sex- and gender-specific insights across the spectrum of cardiometabolic disorders.","Rotterdam, Netherlands",Erasmus MC University Medical Center,Maryam Kavousi,m.kavousi@erasmusmc.nl,Maryam Kavousi; Ali Farzaneh,m.kavousi@erasmusmc.nl; a.farzanehalanagh@erasmusmc.nl,14926,5/7/1989,,yes,,"Baseline and follow-up in-person examinations every 3 to 6 years, including home interviews and in-facility medical assessments. Continuous follow-up for health outcomes via automated linkage with general practitioners, pharmacy records, hospital discharge letters, national cancer registry, and other health databases. Repeated laboratory measurements and imaging (MRI, CT, ultrasound) as scheduled per sub-study. ",Dutch (primary);English ( For scientific documentation ),SPSS,Own coding system,,,male=41.2%;female=58.8%,myocardial infarction; heart failure; atrial fibrillation; stroke; Diabetes;  metabolic diseases; Neurodegenerative and psychiatric disorders,European descent,65.8 ± 10.4,,,,,, <= 76.2 and  >= 55.4  years old,,,,,,,,,,percutaneous coronary intervention (PCI);coronary artery bypass graft (CABG),,"The Rotterdam Study does not have a single primary outcome due to its broad, multi-disease, population-based design. Instead, it focuses on multiple major outcomes related to chronic and age-related diseases. These include incident cardiovascular events (e.g., myocardial infarction, heart failure, atrial fibrillation), neurodegenerative diseases (e.g., dementia, Parkinson’s disease), diabetes, cancer, respiratory diseases, and mortality","quality of life assessments;disability;functional decline;mental health outcomes; sleep quality; lifestyle factors;Long-term morbidity; mortality across multiple domains (including cardiovascular, neurological, metabolic, oncological) are also evaluated. ",,,,
SFDT1,early risk,observational design,"Our primary objective is to identify new risk factors associated with Major adverse cardiovascular events in patients with T1D; The secondary objectives are, in patients with T1D, to:   1)Evaluate classical risk factors associated with incident MACE in patients with T1D; 2)Evaluate the role of GV (including hypoglycaemia) in health events (complications, QoL, mortality); 3) Evaluate the relationship between microangiopathy and macrovascular complications;  4) Identify and characterise novel biomarkers and metabolic pathways associated to health events (complications, QoL, mortality); 5) Identify psychosocial factors associated with health events (complications, QoL, mortality); 6) Identify the impacts of therapeutic innovations and care on metabolic control and diabetic  complications; 7)Identify the impact of medications on metabolic control and diabetic complication; 8) Assessing the economic burden of T1D and its complications using various perspePROectives and according to both patients’ clinical and socio-economic characteristics and their health care pathways. To reach these objectives, we will build a robust research resource that can facilitate the exploration of biological, clinical, social, and environmental determinants of T1D and its  complications; also beyond this study with a health data warehouse datastore format.",France,Francophone Foundation for Diabetes Research,Jean-Pierre Riveline,jeanpierre.riveline@aphp.fr,Jean-Pierre Riveline,jeanpierre.riveline@aphp.fr,1000,2020,,yes,,"Basline,  every three years (+ CGM every three month and ePRO each month)",French,,,"routine clinical care and biobanking (urine, saliva, hair, plasma, serum, genetics)",,male=51.1%; female=48.9%,type 1 diabetes mellitus,,39.3 ± 5.8,100%,,,type 1 diabetes mellitus,"Type 1  diabetes mellitus, defined as Age at diagnosis of diabetes > 1 year and  <= 35 years. Insulin treatment initiated within the first 12 months following diabetes discovery", >=6 years old ,,,,,Insulin treatment initiated within the first 12 months following diabetes discovery ,Patient under guardianship or protection for vulnerable people,,,,variable,,"non-fatal myocardial infarction (MI); non-fatal stroke; CV-related  death (defined as a death occurring within 30 days after a diagnosis for MI, stroke, unstable angina, heart failure, sudden cardiac arrest, cardiogenic shock, other cerebrovascular events, or other CV events recorded in a medical claim in any settings) ","Macrovascular complications: MACE and individual components; Microvascular complications: Retinopathy, nephropathy, neuropathy, foot deformities, classified per international guidelines; Other complications: Musculoskeletal disorders, periodontal disease, cancer; Mortality;Quality of Life: Assessed by EQ-5D-5L; Determinants analyzed; Classical risk factors for MACE: Age, sex, smoking, hypertension, lipids, family history, bariatric surgery, apnea, arterial disease, female reproductive factors, elderly vulnerability; Glycemic variability and hypoglycemia: CGM metrics, hypoglycemia levels 1-3, severe events, awareness scores;Microangiopathy–macrovascular links;Novel biomarkers: Inflammatory markers, genetic/epigenetic factors, environmental exposures via biobank samples; Psychosocial factors: Education, employment, validated questionnaires on anxiety, eating disorders, deprivation; Therapeutic innovations and care: Diabetes visits, insulin therapy, CGM devices, telemedicine, islet transplantation; Metabolic control: DKA history, HbA1c, anthropometrics, CGM time-in-range metrics; Medications: Diabetes-related and other drugs; Economic burden: Healthcare resource use and costs from claims data (SNDS), socio-demographics, mortality.",,,92,
TheBox,post myocardial infarction,observational design,Modelling clinical decision making and out patient management of risk factor for cardiovascular disease,"Leiden and surrounding area, the Netherlands",Leiden University Medical Center,Wouter van der Loo,w.p.m.van_der_loo@lumc.nl,Douwe Atsma,d.e.atsma@lumc.nl,1700,2016,,yes,,"Patient initiated, recommended at least once a week for wearable data. Clinical parameters at first admission, 1, 3, 6 and 12 months",Dutch,"csv, json",Own coding system,"wearable measurements at home for blood pressure, weight, steps and single lead ECG",Standard care,70.7% male; 29.3% female,Myocardial infarction,Mixed; not registered,65.7 ± 11.9,,100%,,myocardial infarction,myocardial infarction,,,,,Yes,,,,,,variable,,mean difference in blood pressure and weight reduction;mean heart rate; reduction in LDL,,,,,
TeleCheck- AF,Cadiovascular diseases/Chronic kidney disease but no structural/functional heart disease,observational design,,,AZM,,,,,1480,,,,,,,,,,,,,,,,,,,,,,,,,,,,,,,,,,,,,
STOP-HF,early risk,observational design,,,University College Dublin,,,Schuaiwei,shuaiwei@heartbeattrust.ie,2000,,,,,,,,,,,male=47.1%; female=52.9%,,,69.7 ± 11.6,,,,,, <= 81.3 and  >= 58.1  years old,,,,,,,,,,,,,,,,,
SOPHIA-IMI,early risk,retrospective study design,,,SIB Swiss Institute of Bioinformatics,,,Mark Ibbersen,Mark.Ibberson@sib.swiss,100000,,,,,,,,,,,,,,,,,,,,,,,,,,,,,,,,,,,,,
TIM-HF,established Heart failure,randomized controlled trial,,,CHARITE,,,Friedrich Köhler,friedrich.koehler@charite.de,710,,,,,,,,,,,,,,,,,,,,,,,,,,,,,,,,,,,,1661,
TIM-HF2,established Heart failure,randomized controlled trial,,,CHARITE,,,Friedrich Köhler,friedrich.koehler@charite.de,1538,,,,,,,,,,,,,,,,,,,,,,,,,,,,,,,,,,,,,
UCD-HF-cohort,established Heart failure,observational design,,,University College Dublin,,,Matthew Barrett,mjbarrett7@gmail.com,25,,,,,,,,,,,,,,,,,,,,,,,,,,,,,,,,,,,,,
ViennaDiabetes,early risk,observational design,observational registry to evaluate cardiac / HF risk in T2DM patients ,Austria,Medical University of Vienna,,,Martin Huelsmann; Noemi Pavo,martin.huelsmann@meduniwien.ac.at; noemi.pavo@meduniwien.ac.at,2186,,,no,,single point,german,SPSS,Own coding system,"cohort study - no specific intervention, routine clinical care",,,,,range 16-92,100%,,all patients,Type 2 diabetes mellitus,,> 16 years old,,,,,,,,,,,,all-cause death,,,,,
ViennaHF-Register,established Heart failure,observational design,"observational, prospective registry with biobank to assess the characteristics of HFrEF patients and evaluate treatment trends, treatment response and outcomes",Vienna / Austria,Medical University of Vienna,,,Martin Huelsmann; Noemi Pavo,martin.huelsmann@meduniwien.ac.at; noemi.pavo@meduniwien.ac.at,1085,2011,,yes,,"as clinically appropriate (routine visits in 3, 6 or 12 months according to risk)",german,Excel,Own coding system,,,,,,,30%,,all patients,heart failure with reduced ejection fraction,,> 18 years old,,,,,,,,,,,,"all-cause death;hospitalizations classified as planned or unplanned for reasons of heart failure, coronary artery disease, rhythm disturbances or other ischemic/bleeding events",,,,,
FITBEAT,,observational design,,Belgium,IMEC,,,John Morales Tellez,John.MoralesTellez@imec.nl,0,,,,,,,,,,,male=23%; female=77%,,,64±9,,,,,, <= 73 and  >= 55  years old,,,,,,,,,,,,,,,,,
ALOHAS,,observational design,,Belgium,IMEC,,,John Morales Tellez,John.MoralesTellez@imec.nl,0,,,,,,,,,,,male=100%,,,52 ± 7,,,,,, <= 59 and  >= 45  years old,,,,,,,,,,,,,,,,,
DECADE,Coronary arthery disease,observational design,This study aims to validate if the gyroscope and accelerometer derived parameters can identify patients with hemodynamically significant CAD in combined contrast CT coronary angiography and PET perfusion imaging in combination of high-sensitive troponin testing. We hypothesize that change and details in cardiac cycle and cardiac contractility is measurable with GCG and therefore we are able to detect changes related to CAD. Further risk stratification especially in border-line cases can be made based on high-sensitive troponin results. For prognostic risk analysis cardiovascular outcomes will be collected from hospital health records at 1 year and 2 years after the baseline measurements.,Finland,Precordior,Mia koutu,mia.koutu@cardiosignal.com ,Mia koutu,mia.koutu@cardiosignal.com ,930,28.1.2020,16.12.2021,no,Basic pseudonymisation,One visit,English,excel,Own coding system,,CT and PET imaging,male=42.5%;female=57.5%,Coronary artery disease,,65 ± 11.9,24,,male and female,Suspected Coronary Artery Disease ,Patients visiting hospital for suspected CAD and undergoing CCTA,>18 years old,,,,Patients visiting hospital for suspected CAD and undergoing CCTA,,,,,,,,To validate if the gyroscope and accelerometer derived parameters can identify patients with hemodynamically significant CAD in combined contrast CT coronary angiography and PET perfusion imaging in combination of high-sensitive troponin testing,,,,,
REFLECS,Heart failure,observational design,"The study aims to validate HF specific characteristics obtained with accelerometer and gyroscope against the current gold standard, detailed echocardiography examination in individuals already diagnosed with HF. Data of anonymised subjects without diagnosed or suspected HF will be used as controls to study the detection of HF. From data derived from these sensors, we hypothesize that the echocardiography validated signals will enable to detect changes characteristic for HF and HF decompensation providing detection accuracy of >80%.",Finland,Precordior,Mia koutu,mia.koutu@cardiosignal.com ,Mia koutu,mia.koutu@cardiosignal.com ,320,1.6.2020,21.12.2021,no,Basic pseudonymisation,"2 planned visits for each study patient: baseline and follow-up. The data is also collected during the discharge of the patient. If the patient visits hospital in between the scheduled visits for cardiac reasons, the echocardiography and gyrocardiography measurements are aimed to be repeated during this visit if applicable.",English,excel,Own coding system,,Echocardiography,male=61.5%;female=38.5%,Heart failure,,62 ± 10.9,7,,male and female,Heart failure,"Patients visiting hospital for heart failure, either outpatient clinic or cardiac or internal medicine ward",>18 years old,,,,"Patients visiting hospital for heart failure, either outpatient clinic or cardiac or internal medicine ward",,Severe cardiac valve disease; Previous prosthetic cardiac valve; Major adverse cardiovascular event (excluding heart failure) or surgery within 6 weeks of planned study enrollment if considered significant by the principal investigator; Patients with pacemaker.,,,Surgery within 6 weeks of planned study enrollment if considered significant by the principal investigator,Previous prosthetic cardiac valve,Severe cardiac valve disease; Previous prosthetic cardiac valve; Major adverse cardiovascular event (excluding heart failure) or surgery within 6 weeks of planned study enrollment if considered significant by the principal investigator; Patients with pacemaker.,"The study aims to validate heart failure specific characteristics obtained with accelerometer and gyroscope against the current gold standard, detailed echocardiography examination in individuals already diagnosed with HF. Data of anonymised subjects without diagnosed or suspected HF will be used as controls to study the detection of HF. ","Secondary objectives include patient follow-up with a smartphone with once daily measurement at home with Precordior mobile application for those patient willing to participate to this part of the study as well. The application records MEMS signals and heart rate. Smartphone based activity measurement, 5 question HF questionnaire and daily weight are recorded. Each component measured, MEMS signals, heart rate, activity, weight and 5 symptom questionnaire will be analyzed as a composite and separately against possible HF decompensation",,,,
PEARLS,early risk,observational design,,,Maastricht University Medical Centre,,,Christof Peters,christof.peters@mumc.nl,Err:522,,,,,,,,,,,,,,,,,,,,,,,,,,,,,,,,,,,,,
